<?xml version="1.0" encoding="UTF-8"?>
<!-- XML Sample Message of message hierarchy                                          -->
<!-- Message:             ADC GL Source v1.0 Rev. 4                                   -->
<!-- Transaction:         AA - Audit Data Collection Rev. 235                         -->
<!-- Datamodel:           Audit Data Collection Datamodel, version HEAD Rev. 312      -->
<!-- XML tagset used:     AdcsML                                                      -->
<!-- Generated at:        23-01-2021 17:17:52                                         -->
<!-- Generated using:     EC-Design 2.5.0 (http://www.ec-design.nl)                   -->
<!-- Generated by:        Jan Vrijenhoek (Digitect)                                   -->
<!-- Organisation:        Digitect B.V. (Digitect)                                    -->
<!-- NOTE:    This sample message was generated automatically: manual modifications will be lost -->
<AdcGlSource xsi:schemaLocation="http://schemas.iso.org/AdcsML/Messages/AdcGlSource-v1 AdcGlSource-v1.0.xsd"
		xmlns="http://schemas.iso.org/AdcsML/Messages/AdcGlSource-v1"
		xmlns:xsi="http://www.w3.org/2001/XMLSchema-instance">
	<GlSrc>
		<SrcCd>SOURCE1</SrcCd>
		<SrcDscr>Sales and purchase department.</SrcDscr>
		<ErpSbldgrMod>S&amp;P</ErpSbldgrMod>
		<SystManualId>M</SystManualId>
		<BusProcMajor>Sales and purchase.</BusProcMajor>
		<BusProcMinor>Large customers.</BusProcMinor>
	</GlSrc>
</AdcGlSource>
